Notation,Load Effect,Notes
D,Dead load,See IBC 1606 and Chapter 3 of this publication
E,Combined effect of horizontal and vertical earthquake-induced forces as defined in ASCE/SEI 12.4.2,"See IBC 1613, ASCE/SEI 12.4.2 and Chapter 6 of this publication"
Em ,Maximum seismic load effect of horizontal and vertical forces as set forth in ASCE/SEI 12.4.3,"See IBC 1613, ASCE/SEI 12.4.3 and Chapter 6 of this publication"
H,"Load due to lateral earth pressures, ground water pressure or pressure of bulk materials",See IBC 1610 for soil lateral loads
L,"Live load, except roof live load, including any permitted live load reduction",See IBC 1607 and Chapter 3 of this publication
Li,Roof live load including any permitted live load reduction,See IBC 1607 and Chapter 3 of this publication
R,Rain load,See IBC 1611 and Chapter 3 of this publication
W,Load due to wind pressure,See IBC 1609 and Chapter 5 of this publication
